<?xml version="1.0" encoding="UTF-8"?>
<biker name="Johan"
       xmlns:xsi="http://www.w3.org/2001/XMLSchema-instance"
       xsi:noNamespaceSchemaLocation="Biker.xsd">
    <boots>
        <brand>Alpine</brand>
        <weight>3.5</weight>
        <price>215.35</price>
        <size>40.0</size>
        <ventilation>true</ventilation>
        <type>Sport</type>
    </boots>
    <gloves>
        <brand>Alpine</brand>
        <weight>0.6</weight>
        <price>80.0</price>
        <size>2.0</size>
        <ventilation>true</ventilation>
        <type>Sport</type>
        <material>Leather</material>
    </gloves>
    <helmet>
        <brand>ARAI</brand>
        <weight>1.58</weight>
        <price>326.0</price>
        <size>58.0</size>
        <ventilation>true</ventilation>
        <type>Street</type>
        <colorOfVisor>Transparent</colorOfVisor>
    </helmet>
    <jacket>
        <brand>DAINESE</brand>
        <weight>1.23</weight>
        <price>180.54</price>
        <size>48.0</size>
        <ventilation>true</ventilation>
        <material>Cevlar</material>
        <buildInProtection>true</buildInProtection>
    </jacket>
    <pants>
        <brand>DAINESE</brand>
        <weight>1.5</weight>
        <price>190.15</price>
        <size>48.0</size>
        <ventilation>false</ventilation>
        <material>Cevlar</material>
        <buildInProtection>true</buildInProtection>
    </pants>
</biker>