<?xml version="1.0" encoding="UTF-8"?>
<biker name="Johan"
       xmlns:xsi="http://www.w3.org/2001/XMLSchema-instance"
       xsi:noNamespaceSchemaLocation="Biker.xsd">

    <boots>
        <type/>
        Sport
        <brand/>
        Alpine
        <weight/>
        3.5
        <price/>
        215.35
        <size/>
        40
        <ventilation/>
        true
    </boots>

    <gloves>
        <type/>
        Sport
        <brand/>
        Alpine
        <material/>
        Leather
        <weight/>
        0.6
        <price/>
        80
        <size/>
        2
        <ventilation/>
        true
    </gloves>

    <helmet>
        <type/>
        Street
        <colorOfVisor/>
        Transparent
        <brand/>
        ARAI
        <weight/>
        1.58
        <price/>
        326
        <size/>
        58
        <ventilation/>
        true
    </helmet>

    <jacket>
        <material/>
        Cevlar
        <buildInProtection/>
        true
        <brand/>
        DAINESE
        <weight/>
        1.23
        <price/>
        180.54
        <size/>
        48
        <ventilation/>
        true
    </jacket>

    <pants>
        <material/>
        Cevlar
        <buildInProtection/>
        true
        <brand/>
        DAINESE
        <weight/>
        1.5
        <price/>
        190.15
        <size/>
        48
        <ventilation/>
        false
    </pants>

</biker>